{
  "object": "session",
  "id": "example",
  "user_id": "user_2abc4xyz567Q9zZdEf",
  "client_id": "client_2abc4xyz567Q9zZdEf",
  "actor": {},
  "status": "active",
  "last_active_organization_id": "org_2abc4xyz567Q9zZdEf",
  "last_active_at": 0,
  "latest_activity": {
    "object": "user",
    "id": "example",
    "device_type": "example",
    "is_mobile": false,
    "browser_name": "example",
    "browser_version": "example",
    "ip_address": "example",
    "city": "example",
    "country": "example"
  },
  "expire_at": 1747939800,
  "abandon_at": 0,
  "updated_at": 0,
  "created_at": 0,
  "tasks": [
    {
      "key": "example"
    }
  ]
}